{
  "schemaVersion": 1,
  "solution": "paas",
  "status": "draft",
  "paths": {
    "architecture": null,
    "componentRegistry": null,
    "designTokens": null
  },
  "tokens": {
    "brand": {},
    "color": {},
    "typography": {},
    "border": {},
    "spacing": {},
    "radius": {},
    "elevation": {},
    "motion": {}
  },
  "components": {},
  "pagePatterns": {
    "list": {},
    "create": {},
    "detail": {}
  },
  "documentOverrides": [],
  "exceptions": [],
  "inheritCommon": true
}
